{
  "claim_boundary": "Three correctness-gated repeats on GitHub-hosted VMs; repeat-to-repeat spread is retained, no best or canonical repeat is selected, and the series is not dedicated-host evidence or a general production-performance ranking.",
  "evidence_class": "github-hosted-exploratory",
  "fixture": {
    "bundle_sha256": "0c478804dfbfd66346799e87eb8d1beafd926ecaa252832ff5d31d63fc8d6ce7",
    "id": "minimal-static",
    "input": "benchmarks/fixtures/minimal-static/comparator.html",
    "input_sha256": "657b662eee0d7df8ae89db504712d2aadff1add2a740fc79b3c49000f1fc8cc8"
  },
  "generated_at": "2026-08-29T08:47:58.516876+00:00",
  "oracle": {
    "contract": "pliego.pdf-oracle.v1",
    "oracle_path": "/home/runner/work/pliego/pliego/benchmarks/tools/pdf_oracle.py",
    "oracle_sha256": "2faba9d9a20d426f36082dd8f817b7a3057fc85907a1624b2e70b434355489ee",
    "pdffonts_path": "/usr/bin/pdffonts",
    "pdffonts_sha256": "9855e69c629b8d67423864ba4657750efba3c76370ca02106b157668e9c2190c",
    "pdffonts_version": "pdffonts version 24.02.0",
    "pdfinfo_path": "/usr/bin/pdfinfo",
    "pdfinfo_sha256": "3293dda06d80e1e38dab859aa47368c2876aedc41cbc2e24e8fb9a4e66392078",
    "pdfinfo_version": "pdfinfo version 24.02.0",
    "pdftoppm_path": "/usr/bin/pdftoppm",
    "pdftoppm_sha256": "207dcabcaeea0ce572aefc498d07d44d56a9ca06a85b3ae1fecd050476a34bf8",
    "pdftoppm_version": "pdftoppm version 24.02.0",
    "pdftotext_path": "/usr/bin/pdftotext",
    "pdftotext_sha256": "0fb98ea179e19154a90202608c164f2a319b79f16576fa6534b2d601033565e7",
    "pdftotext_version": "pdftotext version 24.02.0"
  },
  "protocol": {
    "correctness_preflight_iterations": 1,
    "fixture_id": "minimal-static",
    "measurement_method": "linux-cgroup-v2-v1",
    "network": "private-loopback-only",
    "percentile_method": "nearest-rank-v1",
    "sample_count": 100,
    "sample_order": "globally-interleaved-seeded",
    "schedule_contract": "pliego.cross-target-schedule.v1",
    "seed": 1,
    "targets": [
      "browsershot-5.4.0-puppeteer-25.8.0",
      "dompdf-3.1.6",
      "pliego-0.3.3"
    ],
    "warmup_iterations": 10
  },
  "publication_status": "hosted-series",
  "runner_image": {
    "image_os": "ubuntu24",
    "image_version": "20260823.283.1"
  },
  "runs": [
    {
      "ambient": {
        "after": {
          "loadavg": "2.09 2.03 1.11 1/252 25824",
          "meminfo": "MemTotal:       16377684 kB\nMemFree:         7806780 kB\nMemAvailable:   15125840 kB\nBuffers:          256084 kB\nCached:          6920964 kB\nSwapCached:            0 kB\nActive:           890376 kB\nInactive:        6612696 kB\nActive(anon):     384276 kB\nInactive(anon):        0 kB\nActive(file):     506100 kB\nInactive(file):  6612696 kB\nUnevictable:       46752 kB\nMlocked:           43680 kB\nSwapTotal:       3145724 kB\nSwapFree:        3145724 kB\nZswap:                 0 kB\nZswapped:              0 kB\nDirty:               152 kB\nWriteback:             0 kB\nAnonPages:        356076 kB\nMapped:           322752 kB\nShmem:             49528 kB\nKReclaimable:     546228 kB\nSlab:             679276 kB\nSReclaimable:     546228 kB\nSUnreclaim:       133048 kB\nKernelStack:        4080 kB\nPageTables:         6664 kB\nSecPageTables:         0 kB\nNFS_Unstable:          0 kB\nBounce:                0 kB\nWritebackTmp:          0 kB\nCommitLimit:    11334564 kB\nCommitted_AS:    2060420 kB\nVmallocTotal:   34359738367 kB\nVmallocUsed:       39408 kB\nVmallocChunk:          0 kB\nPercpu:             2288 kB\nHardwareCorrupted:     0 kB\nAnonHugePages:    174080 kB\nShmemHugePages:        0 kB\nShmemPmdMapped:        0 kB\nFileHugePages:    118784 kB\nFilePmdMapped:         0 kB\nCmaTotal:              0 kB\nCmaFree:               0 kB\nUnaccepted:            0 kB\nBalloon:               0 kB\nHugePages_Total:       0\nHugePages_Free:        0\nHugePages_Rsvd:        0\nHugePages_Surp:        0\nHugepagesize:       2048 kB\nHugetlb:               0 kB\nDirectMap4k:      130312 kB\nDirectMap2M:     3014656 kB\nDirectMap1G:    15728640 kB",
          "pressure_cpu": "some avg10=4.72 avg60=4.51 avg300=4.06 total=28700244\nfull avg10=0.00 avg60=0.00 avg300=0.00 total=0",
          "pressure_io": "some avg10=6.67 avg60=6.60 avg300=6.25 total=50161687\nfull avg10=4.70 avg60=4.85 avg300=4.86 total=41535696",
          "pressure_memory": "some avg10=0.00 avg60=0.00 avg300=0.00 total=9\nfull avg10=0.00 avg60=0.00 avg300=0.00 total=9",
          "process_count": 158
        },
        "before": {
          "loadavg": "1.82 0.72 0.27 2/259 3259",
          "meminfo": "MemTotal:       16377684 kB\nMemFree:         8012960 kB\nMemAvailable:   15169060 kB\nBuffers:          195120 kB\nCached:          6820976 kB\nSwapCached:            0 kB\nActive:           749224 kB\nInactive:        6549972 kB\nActive(anon):     340056 kB\nInactive(anon):        0 kB\nActive(file):     409168 kB\nInactive(file):  6549972 kB\nUnevictable:       46752 kB\nMlocked:           43680 kB\nSwapTotal:       3145724 kB\nSwapFree:        3145724 kB\nZswap:                 0 kB\nZswapped:              0 kB\nDirty:            443940 kB\nWriteback:             0 kB\nAnonPages:        317900 kB\nMapped:           325708 kB\nShmem:             48208 kB\nKReclaimable:     542924 kB\nSlab:             674008 kB\nSReclaimable:     542924 kB\nSUnreclaim:       131084 kB\nKernelStack:        4228 kB\nPageTables:         7032 kB\nSecPageTables:         0 kB\nNFS_Unstable:          0 kB\nBounce:                0 kB\nWritebackTmp:          0 kB\nCommitLimit:    11334564 kB\nCommitted_AS:    2062972 kB\nVmallocTotal:   34359738367 kB\nVmallocUsed:       39552 kB\nVmallocChunk:          0 kB\nPercpu:             2240 kB\nHardwareCorrupted:     0 kB\nAnonHugePages:     83968 kB\nShmemHugePages:        0 kB\nShmemPmdMapped:        0 kB\nFileHugePages:    118784 kB\nFilePmdMapped:         0 kB\nCmaTotal:              0 kB\nCmaFree:               0 kB\nUnaccepted:            0 kB\nBalloon:               0 kB\nHugePages_Total:       0\nHugePages_Free:        0\nHugePages_Rsvd:        0\nHugePages_Surp:        0\nHugepagesize:       2048 kB\nHugetlb:               0 kB\nDirectMap4k:      130312 kB\nDirectMap2M:     3014656 kB\nDirectMap1G:    15728640 kB",
          "pressure_cpu": "some avg10=0.02 avg60=0.64 avg300=0.41 total=2063031\nfull avg10=0.00 avg60=0.00 avg300=0.00 total=0",
          "pressure_io": "some avg10=23.93 avg60=11.68 avg300=3.54 total=12186425\nfull avg10=23.81 avg60=11.37 avg300=3.36 total=11419116",
          "pressure_memory": "some avg10=0.00 avg60=0.00 avg300=0.00 total=0\nfull avg10=0.00 avg60=0.00 avg300=0.00 total=0",
          "process_count": 163
        }
      },
      "comparison_sha256": "00aef39189f127b0db2696f4b6eb3c4bde2db140789181b242132c031428ed84",
      "generated_at": "2026-08-29T08:47:13.577850+00:00",
      "host": {
        "arch": "x86_64",
        "cgroup": {
          "clocksource": "tsc",
          "controllers": "cpuset cpu io memory hugetlb pids rdma misc dmem",
          "cpu_max": null,
          "cpuset_cpus_effective": "0-3",
          "memory_max": null,
          "mount": "/sys/fs/cgroup cgroup2 rw,nosuid,nodev,noexec,relatime,nsdelegate,memory_recursiveprot",
          "pids_max": null,
          "self": "0::/system.slice/run-u23.service/harness"
        },
        "cores": 4,
        "cpu_model": "AMD EPYC 7763 64-Core Processor",
        "dedicated": false,
        "kernel": "6.17.0-1022-azure",